{
  "version": "1.0.0",
  "metadata": {
    "session_id": "b7f62f26-9744-774d-3bd8-184351fc3990",
    "recorded_at": "2026-06-18T18:50:28.381003Z",
    "total_duration_ms": 8300,
    "frame_rate": 30,
    "resolution": {
      "width": 1280,
      "height": 720
    },
    "source_session_file": "C:\\Users\\Ahmed\\Desktop\\69\\sprint2\\claude\\New folder\\3\\vlm_render_mapper_final\\sample_session.json",
    "render_target": "ffmpeg"
  },
  "viewport": {
    "width": 1280,
    "height": 720,
    "device_pixel_ratio": 1.0
  },
  "frames": [
    {
      "frame_id": "frame_000000",
      "source_action_index": 0,
      "start_ms": 0,
      "duration_ms": 1500,
      "screenshot_ref": "screenshots/frame_000000.png",
      "action": {
        "type": "navigate",
        "target": null,
        "value": "https://example.com",
        "coordinates": null,
        "modifiers": [],
        "scroll_delta": null,
        "drag_start": null,
        "drag_end": null
      },
      "cursor": null,
      "highlight_regions": [],
      "zoom_region": null,
      "caption_ids": [
        "cap_frame_000000"
      ]
    },
    {
      "frame_id": "frame_000001",
      "source_action_index": 1,
      "start_ms": 1500,
      "duration_ms": 200,
      "screenshot_ref": "screenshots/frame_000001.png",
      "action": {
        "type": "click",
        "target": "#search-input",
        "value": null,
        "coordinates": {
          "x": 640.0,
          "y": 200.0
        },
        "modifiers": [],
        "scroll_delta": null,
        "drag_start": null,
        "drag_end": null
      },
      "cursor": {
        "x": 640.0,
        "y": 200.0,
        "visible": true,
        "style": "pointer"
      },
      "highlight_regions": [],
      "zoom_region": null,
      "caption_ids": []
    },
    {
      "frame_id": "frame_000002",
      "source_action_index": 1,
      "start_ms": 1700,
      "duration_ms": 200,
      "screenshot_ref": "screenshots/frame_000001.png",
      "action": {
        "type": "click",
        "target": "#search-input",
        "value": null,
        "coordinates": {
          "x": 640.0,
          "y": 200.0
        },
        "modifiers": [],
        "scroll_delta": null,
        "drag_start": null,
        "drag_end": null
      },
      "cursor": {
        "x": 640.0,
        "y": 200.0,
        "visible": true,
        "style": "pointer"
      },
      "highlight_regions": [
        {
          "region_id": "hl_frame_000002",
          "x": 610.0,
          "y": 170.0,
          "width": 60.0,
          "height": 60.0,
          "color": "#FF4444",
          "opacity": 0.35,
          "border_radius": 30.0,
          "border_color": null,
          "border_width": null,
          "label": "Click on #search-input"
        }
      ],
      "zoom_region": {
        "x": 133.33,
        "y": 0.0,
        "width": 1013.33,
        "height": 640.0,
        "scale": 1.5,
        "easing": "ease_in_out",
        "transition_duration_ms": 300
      },
      "caption_ids": [
        "cap_frame_000001"
      ]
    },
    {
      "frame_id": "frame_000003",
      "source_action_index": 2,
      "start_ms": 1900,
      "duration_ms": 600,
      "screenshot_ref": "screenshots/frame_000002.png",
      "action": {
        "type": "type",
        "target": "#search-input",
        "value": "render plan example",
        "coordinates": null,
        "modifiers": [],
        "scroll_delta": null,
        "drag_start": null,
        "drag_end": null
      },
      "cursor": null,
      "highlight_regions": [],
      "zoom_region": null,
      "caption_ids": [
        "cap_frame_000003"
      ]
    },
    {
      "frame_id": "frame_000004",
      "source_action_index": 3,
      "start_ms": 2500,
      "duration_ms": 1500,
      "screenshot_ref": "screenshots/frame_000003.png",
      "action": {
        "type": "key_press",
        "target": null,
        "value": "Enter",
        "coordinates": null,
        "modifiers": [],
        "scroll_delta": null,
        "drag_start": null,
        "drag_end": null
      },
      "cursor": null,
      "highlight_regions": [],
      "zoom_region": null,
      "caption_ids": [
        "cap_frame_000004"
      ]
    },
    {
      "frame_id": "frame_000005",
      "source_action_index": 4,
      "start_ms": 4000,
      "duration_ms": 1500,
      "screenshot_ref": "screenshots/frame_000004.png",
      "action": {
        "type": "page_load",
        "target": null,
        "value": "https://example.com/results?q=render+plan+example",
        "coordinates": null,
        "modifiers": [],
        "scroll_delta": null,
        "drag_start": null,
        "drag_end": null
      },
      "cursor": null,
      "highlight_regions": [],
      "zoom_region": null,
      "caption_ids": [
        "cap_frame_000005"
      ]
    },
    {
      "frame_id": "frame_000006",
      "source_action_index": 5,
      "start_ms": 4900,
      "duration_ms": 500,
      "screenshot_ref": "screenshots/frame_000005.png",
      "action": {
        "type": "scroll",
        "target": null,
        "value": null,
        "coordinates": null,
        "modifiers": [],
        "scroll_delta": {
          "x": 0.0,
          "y": 300.0
        },
        "drag_start": null,
        "drag_end": null
      },
      "cursor": null,
      "highlight_regions": [],
      "zoom_region": null,
      "caption_ids": [
        "cap_frame_000006"
      ]
    },
    {
      "frame_id": "frame_000007",
      "source_action_index": 6,
      "start_ms": 5400,
      "duration_ms": 200,
      "screenshot_ref": "screenshots/frame_000006.png",
      "action": {
        "type": "click",
        "target": ".result-item:first-child a",
        "value": null,
        "coordinates": {
          "x": 400.0,
          "y": 450.0
        },
        "modifiers": [],
        "scroll_delta": null,
        "drag_start": null,
        "drag_end": null
      },
      "cursor": {
        "x": 400.0,
        "y": 450.0,
        "visible": true,
        "style": "pointer"
      },
      "highlight_regions": [],
      "zoom_region": null,
      "caption_ids": []
    },
    {
      "frame_id": "frame_000008",
      "source_action_index": 6,
      "start_ms": 5600,
      "duration_ms": 200,
      "screenshot_ref": "screenshots/frame_000006.png",
      "action": {
        "type": "click",
        "target": ".result-item:first-child a",
        "value": null,
        "coordinates": {
          "x": 400.0,
          "y": 450.0
        },
        "modifiers": [],
        "scroll_delta": null,
        "drag_start": null,
        "drag_end": null
      },
      "cursor": {
        "x": 400.0,
        "y": 450.0,
        "visible": true,
        "style": "pointer"
      },
      "highlight_regions": [
        {
          "region_id": "hl_frame_000008",
          "x": 370.0,
          "y": 420.0,
          "width": 60.0,
          "height": 60.0,
          "color": "#FF4444",
          "opacity": 0.35,
          "border_radius": 30.0,
          "border_color": null,
          "border_width": null,
          "label": "Click on .result-item:first-child a"
        }
      ],
      "zoom_region": {
        "x": 0.0,
        "y": 130.0,
        "width": 1013.33,
        "height": 640.0,
        "scale": 1.5,
        "easing": "ease_in_out",
        "transition_duration_ms": 300
      },
      "caption_ids": [
        "cap_frame_000007"
      ]
    },
    {
      "frame_id": "frame_000009",
      "source_action_index": 7,
      "start_ms": 5800,
      "duration_ms": 1000,
      "screenshot_ref": "screenshots/frame_000007.png",
      "action": {
        "type": "hover",
        "target": ".result-item:first-child a",
        "value": null,
        "coordinates": {
          "x": 400.0,
          "y": 450.0
        },
        "modifiers": [],
        "scroll_delta": null,
        "drag_start": null,
        "drag_end": null
      },
      "cursor": {
        "x": 400.0,
        "y": 450.0,
        "visible": true,
        "style": "pointer"
      },
      "highlight_regions": [
        {
          "region_id": "hl_frame_000009",
          "x": 370.0,
          "y": 420.0,
          "width": 60.0,
          "height": 60.0,
          "color": "#4488FF",
          "opacity": 0.25,
          "border_radius": 30.0,
          "border_color": null,
          "border_width": null,
          "label": null
        }
      ],
      "zoom_region": null,
      "caption_ids": [
        "cap_frame_000009"
      ]
    },
    {
      "frame_id": "frame_000010",
      "source_action_index": 8,
      "start_ms": 6800,
      "duration_ms": 1500,
      "screenshot_ref": "screenshots/frame_000008.png",
      "action": {
        "type": "screenshot",
        "target": null,
        "value": null,
        "coordinates": null,
        "modifiers": [],
        "scroll_delta": null,
        "drag_start": null,
        "drag_end": null
      },
      "cursor": null,
      "highlight_regions": [],
      "zoom_region": null,
      "caption_ids": [
        "cap_frame_000010"
      ]
    }
  ],
  "timeline": {
    "segments": [
      {
        "segment_id": "seg_000",
        "start_ms": 0,
        "end_ms": 8300,
        "frame_ids": [
          "frame_000000",
          "frame_000001",
          "frame_000002",
          "frame_000003",
          "frame_000004",
          "frame_000005",
          "frame_000006",
          "frame_000007",
          "frame_000008",
          "frame_000009",
          "frame_000010"
        ],
        "label": "Full session",
        "speed_multiplier": 1.0
      }
    ],
    "total_duration_ms": 8300
  },
  "cursor_path": [
    {
      "timestamp_ms": 0,
      "x": 640.0,
      "y": 200.0,
      "easing": "smoothstep",
      "duration_ms": 0
    },
    {
      "timestamp_ms": 390,
      "x": 633.28,
      "y": 207.0,
      "easing": "smoothstep",
      "duration_ms": 390
    },
    {
      "timestamp_ms": 780,
      "x": 615.04,
      "y": 226.0,